{
  "schema_version": "asw.subscription.v1",
  "subscription_id": "sub_user_vs",
  "subscriber_id": "user:local",
  "subscriber_kind": "user",
  "enabled": true,
  "applications": [
    "app.visual-studio"
  ],
  "categories": [
    "jobs",
    "artifacts",
    "windows_ui"
  ],
  "event_types": [
    "job.failed",
    "artifact.available",
    "dialog.appeared"
  ],
  "destinations": [
    "activity_center",
    "windows_app_sdk"
  ],
  "created_at": "2026-08-01T12:07:00-04:00",
  "updated_at": "2026-08-01T12:07:00-04:00"
}
